{
  "schema": "runtime-mutation-inventory.v1",
  "scope": {
    "authority": "Current production registration and source behavior on the next integration line. This inventory freezes observed behavior; it does not authorize R1-R11 implementation or claim artifact/live evidence.",
    "production_registration": "desktop/src-tauri/src/lib.rs::run generate_handler plus setup, boot, run-event, and Drop hooks, including durable Gateway services and scratch paths reached from those registered surfaces",
    "bundled_callers": [
      "desktop/src/main.js",
      "desktop/src/codex-controller.js",
      "desktop/src/profile-controller.js",
      "desktop/src/runtime-controller.js",
      "desktop/src/skill-page.js"
    ],
    "exclusions": [
      "Unregistered commands in desktop/src-tauri/src/commands/skills.rs are not production surface.",
      "Scratch probes without durable side effects remain transient; Codex scratch model discovery is a durable mutation because it publishes shared catalog cache/invalidation state and may refresh OAuth after upstream 401.",
      "Pure UI one-shot consumption, including pending_notice and boot_attention, is classified but excluded from runtime operation plans.",
      "Migration backups, rolling config backups, and user-selected downgrade exports are frozen as ordered effects and failure outcomes where R0 requires them; they are not generalized into a repository-wide artifact ontology.",
      "Browser/Finder open actions are classified as external side effects, not managed runtime mutations.",
      "Artifact, installed app, live provider, live Science, SSH server, signing, notarization, and public release behavior are NOT-RUN."
    ],
    "test_identity_semantics": "characterization_tests lists required stable identities for R0 completion, not evidence that every identity already exists. The fail-closed inventory test resolves these identities before R0 can be declared complete; planned names remain an explicit incomplete state until their tests are implemented.",
    "characterization_status": "requirements-open"
  },
  "state_owners": [
    {
      "id": "config.desired",
      "kind": "durable-config",
      "durability": "filesystem",
      "authority": "Desired mode, ports, selected profile, profiles, Codex feature/network settings, and path secret.",
      "fields": ["active_id", "codex_network", "experimental_codex_enabled", "mode", "pending_notice", "profiles", "proxy_port", "reuse_system_ssh", "sandbox_port", "secret"],
      "source_anchor": {"path": "desktop/src-tauri/src/config.rs", "symbol": "Config"}
    },
    {
      "id": "config.binding",
      "kind": "durable-config",
      "durability": "filesystem",
      "authority": "Last committed applied runtime profile and route/catalog/binding fingerprints.",
      "fields": ["runtime_binding"],
      "source_anchor": {"path": "desktop/src-tauri/src/config.rs", "symbol": "RuntimeBindingCommit"}
    },
    {
      "id": "config.transaction",
      "kind": "durable-config",
      "durability": "filesystem",
      "authority": "Open one-click/profile-switch recovery transaction with string stage and previous public identities.",
      "fields": ["runtime_transaction"],
      "source_anchor": {"path": "desktop/src-tauri/src/config.rs", "symbol": "RuntimeTransactionJournal"}
    },
    {
      "id": "app.gateway",
      "kind": "process-local",
      "durability": "process",
      "authority": "Tracked Gateway child plus public launch identity and secret-bearing in-memory launch recipe.",
      "fields": ["gateway_kind", "gateway_launch_context", "key_fp", "launch_id", "provider", "proxy", "proxy_port", "secret", "shim_mode"],
      "source_anchor": {"path": "desktop/src-tauri/src/lib.rs", "symbol": "AppState"}
    },
    {
      "id": "app.science",
      "kind": "process-local",
      "durability": "process",
      "authority": "Tracked managed Science child, URL, runtime identity, fast stopped token, and version cache.",
      "fields": ["sandbox", "sandbox_port", "sandbox_url", "science_confirmed_stopped", "science_runtime", "science_version_cache"],
      "source_anchor": {"path": "desktop/src-tauri/src/lib.rs", "symbol": "AppState"}
    },
    {
      "id": "app.boot",
      "kind": "process-local",
      "durability": "process",
      "authority": "Boot coordinator state and frontend-readable error/attention DTOs.",
      "fields": ["boot", "boot_attention", "boot_error"],
      "source_anchor": {"path": "desktop/src-tauri/src/lib.rs", "symbol": "BootState"}
    },
    {
      "id": "app.history",
      "kind": "process-local",
      "durability": "process",
      "authority": "One-shot opaque history-choice references and backend-only candidate/path mapping.",
      "fields": ["history_recovery"],
      "source_anchor": {"path": "desktop/src-tauri/src/lib.rs", "symbol": "HistoryRecoverySession"}
    },
    {
      "id": "app.cleanup",
      "kind": "process-local",
      "durability": "process",
      "authority": "Retry mirror for exact private authority cleanup roots; durable manifest remains authoritative.",
      "fields": ["pending_authority_cleanup"],
      "source_anchor": {"path": "desktop/src-tauri/src/lib.rs", "symbol": "AppState"}
    },
    {
      "id": "lifecycle.global",
      "kind": "process-local",
      "durability": "process",
      "authority": "App-wide serializer and monotonically increasing stale-start generation.",
      "fields": ["generation", "lock"],
      "source_anchor": {"path": "desktop/src-tauri/src/lifecycle.rs", "symbol": "Lifecycle"}
    },
    {
      "id": "codex.supervisor",
      "kind": "process-local",
      "durability": "process",
      "authority": "Codex auth operation snapshot, child registration, mutation/use leases, cancellation, and last safe status.",
      "fields": ["active_operation", "child", "last_auth_status", "mutation_lease", "use_lease"],
      "source_anchor": {"path": "desktop/src-tauri/src/codex_auth_supervisor.rs", "symbol": "CodexAuthSupervisor"}
    },
    {
      "id": "process.gateway",
      "kind": "managed-process",
      "durability": "process",
      "authority": "Formal Rust Gateway listener authenticated by path secret and launch/binary/process identity.",
      "fields": ["child", "listener", "public_health_identity"],
      "source_anchor": {"path": "desktop/src-tauri/src/runtime/proxy_lifecycle/lifecycle.rs", "symbol": "start_proxy_for"}
    },
    {
      "id": "process.science",
      "kind": "managed-process",
      "durability": "process",
      "authority": "Managed Claude Science listener/process identity for the isolated data directory.",
      "fields": ["child", "listener", "runtime_identity"],
      "source_anchor": {"path": "desktop/src-tauri/src/runtime/science/lifecycle.rs", "symbol": "stop_sandbox"}
    },
    {
      "id": "authority.private",
      "kind": "durable-private-files",
      "durability": "filesystem",
      "authority": "CSSwitch-owned snapshot, history marker, pending-cleanup manifest, managed launch receipt, SSH bridge/stub, and isolated Science credential/config files.",
      "fields": ["authority_snapshot", "history_marker", "managed_launch_receipt", "pending_cleanup_manifest", "science_credential", "ssh_bridge", "ssh_stub"],
      "source_anchor": {"path": "desktop/src-tauri/src/runtime/sandbox_session/recovery.rs", "symbol": "OneClickAuthoritySnapshot"}
    },
    {
      "id": "skill.host",
      "kind": "external-host-state",
      "durability": "external",
      "authority": "Committed local or GitHub Skill/bundle files, CSSwitch quarantine, and OPERON attachment state inside the exact healthy Science host context.",
      "fields": ["active_org", "installed_package", "operon_attachment", "quarantined_package"],
      "source_anchor": {"path": "desktop/skill-package/src/install.rs", "symbol": "pub struct InstallCommit"}
    },
    {
      "id": "science.route",
      "kind": "external-host-state",
      "durability": "external",
      "authority": "CSSwitch-owned route marker plus Science third-party connector, disabled-Skill, managed prompt, and OPERON attachment projection for the exact host context.",
      "fields": ["connector_projection", "disabled_skill_projection", "managed_prompt_projection", "operon_attachment", "route_marker"],
      "source_anchor": {"path": "desktop/src-tauri/src/runtime/sandbox_session/route_reconcile.rs", "symbol": "force_third_party_reconcile"}
    },
    {
      "id": "gateway.bridge-key",
      "kind": "durable-private-files",
      "durability": "filesystem",
      "authority": "Current private token file used to authenticate the local Gateway Skill-install bridge for the latest spawned Gateway launch.",
      "fields": ["skill_install_bridge_key"],
      "source_anchor": {"path": "desktop/src-tauri/src/runtime/proxy_lifecycle/skill_bridge.rs", "symbol": "fn write_skill_install_bridge_key("}
    },
    {
      "id": "codex.auth",
      "kind": "durable-private-files",
      "durability": "filesystem",
      "authority": "Gateway-owned Codex authentication state, OAuth record, thinking-key record, and mutation lock under the configured private state root.",
      "fields": ["auth_epoch", "auth_generation", "auth_state", "mutation_lock", "oauth_record", "thinking_record"],
      "source_anchor": {"path": "desktop/gateway/src/codex_auth/storage.rs", "symbol": "pub struct AuthRepository<"}
    },
    {
      "id": "codex.catalog-cache",
      "kind": "durable-private-files",
      "durability": "filesystem",
      "authority": "Gateway-owned Codex model catalog cache and invalidation epoch shared by formal and scratch-models Gateway processes under the configured private auth state root.",
      "fields": ["account_hash", "auth_epoch", "auth_generation", "cache", "etag", "fetched_at", "invalidated", "nonce"],
      "source_anchor": {"path": "desktop/gateway/src/codex_models.rs", "symbol": "pub(crate) struct CodexModelCatalog"}
    },
    {